{
  "schemaVersion": 1,
  "id": "org.example.citation-auditor",
  "name": "Citation auditor",
  "version": "1.0.0",
  "description": "Executable zero-authority example that proposes a revision-guarded citation review note.",
  "runtime": {
    "kind": "wasi-component",
    "component": "citation-auditor.component",
    "world": "syzygy:research/plugin@1.0.0"
  },
  "permissions": {
    "capabilities": ["project.read", "project.propose"],
    "networkDomains": [],
    "modelProviders": []
  },
  "contributions": [
    {
      "kind": "evaluator",
      "id": "citation-coverage",
      "title": "Citation coverage",
      "description": "Find claims that lack source support."
    }
  ]
}
